id;title;datetime;partner;excerpt;text;tags;url
000044;Autocarros da STCP sofrem alteração de percurso devido ao encerramento da Rua dos Clérigos para obras;8 nov 2021 20:06;MadreMedia / Lusa;Os percursos dos autocarros da STCP que circulam na Rua dos Clérigos, no Porto, vão sofrer alterações a partir de quarta-feira, devido ao encerramento desta via para execução das obras de expansão da rede de metro na cidade.;A Rua dos Clérigos ficará interdita ao trânsito a partir de quarta-feira e por um período de cerca de 13 meses devido às obras da Linha Rosa do Metro do Porto.Em comunicado hoje divulgado, a STCP - Sociedade de Transportes Coletivos do Porto explica que, de forma a garantir o serviço de transporte público entre as zonas da Cordoaria e dos Aliados, a câmara do Porto vai implementar alterações de trânsito, como a circulação nos dois sentidos na Praça de Guilherme Gomes Fernandes.A inversão de sentido de trânsito na Rua de Ceuta e na Praça de D. Filipa de Lencastre, exceto transporte público, que terá corredor dedicado no sentido ascendente, assim como a inversão de sentido de trânsito na Rua do Almada, entre a Praça de D. Filipa de Lencastre e a Rua de Ramalho Ortigão, são outras das alterações introduzidas, assim como a inversão de sentido de trânsito na Rua de Ramalho Ortigão.“Com esta nova de solução de mobilidade, a câmara do Porto pretende que o transporte público seja a alternativa mais sustentável para os cidadãos que se deslocam para a baixa do Porto (Aliados). Nesse sentido, serão alterados os percursos de algumas linhas da STCP, bem como serão criadas novas paragens provisórias, em substituição da anterior oferta (Rua dos Clérigos)”, refere a STCP.Como consequência, as linhas 200, 201, 208, 501 e 703, que seguem percurso para a Trindade, terão novas paragens na Rua de Ceuta (sentido descendente) e na Rua Ramalho Ortigão.As linhas 301, 305 e 801, que têm como destino a parte oriental (R. Formosa), terão paragens na Rua de Ceuta (sentido descendente) e na Rua Guilherme Costa Carvalho (junto ao antigo Palácio dos Correios).As linhas 207, 303, 12M e 13M, que descem os Aliados, vão ter paragens na Rua de Ceuta (sentido descendente) e na Avenida dos Aliados (código AAL1), passando a ser o término para as linhas 12M e 13M, dado que deixam de ir à Trindade.Num outro comunicado, a empresa de transportes coletivos do Porto refere que os elétricos na linha 22 vão estar suspensos, a partir de quarta-feira e durante cerca de três anos, devido às obras de alargamento da rede de metro na cidade.“A STCP incentiva todos os portuenses e turistas a viajarem no elétrico da linha 22, até amanhã [terça-feira], para tirarem partido do fantástico passeio pelas ruas do centro do Porto. A suspensão está associada ao evoluir das obras de alargamento da rede de metro na cidade, nomeadamente, da ligação entre as zonas de S. Bento e Boavista, situação que implica que várias artérias da baixa da cidade sejam encerradas ao trânsito, nomeadamente a Rua dos Clérigos”, lê-se no comunicado.A STCP diz ainda que o município do Porto “estabeleceu novas vias de circulação para os veículos automóveis, sublinhando que a linha de elétrico que faz o percurso ‘circular Carmo-Batalha’ (Linha 22) terá de ser encerrada até as obras se darem por concluídas”.Ainda neste comunicado, a STCP refere que vai prolongar a linha do elétrico 18, desde o Museu do Carro Elétrico até ao Passeio Alegre, a partir de sábado (13 de novembro).“Esta linha deixa de fazer apenas a ligação Carmo-Massarelos e passa a realizar o percurso Carmo-Passeio Alegre, contando com mais oito paragens em cada sentido de circulação (Bicalho, Ponte Arrábida, Encosta da Arrábida, Ouro, Fluvial, D. Leonor, Cantareira e Passeio Alegre). A Linha 18 passará a contar com uma oferta de 30 em 30 minutos”, adianta a STCP.;['Porto', 'STCP'];https://24.sapo.pt/atualidade/artigos/autocarros-da-stcp-sofrem-alteracao-de-percurso-devido-ao-encerramento-da-rua-dos-clerigos-para-obras
000045;"Associação de Oficiais das Forças Armadas considera estar em causa ""bom nome"" das FA caso se confirmem suspeitas de tráfico";8 nov 2021 19:58;MadreMedia / Lusa;"A Associação de Oficiais das Forças Armadas (AOFA) considerou hoje que a confirmarem-se as suspeitas de tráfico de diamantes e droga por elementos das Forças Armadas ""está em causa o bom nome"" da instituição e dos militares portugueses.";Em comunicado, a associação comentou a polémica sobre as suspeitas de tráfico de diamantes, ouro e droga provenientes da República Centro-Africana (RCA) por militares portugueses que estiveram destacados naquele país.“Inevitavelmente está em causa o bom nome das Forças Armadas portuguesas e dos militares portugueses” e, por isso, a associação “considera, sem tibiezas, que toda a verdade deve ser apurada até às últimas consequências”.Se houver envolvimento de militares, “deverão ser exemplarmente responsabilizados e punidos sem quaisquer contemplações”, sustenta a nota subscrita pelo presidente da AOFA, António da Costa Mota.No entanto, a associação diz que “não é de todo tolerável que se consumem julgamentos em praça pública, devendo ser escrupulosamente respeitado o princípio fundamental da presunção da inocência”, até à condenação ou ilibação dos suspeitos.“AOFA considera igualmente que todo e qualquer eventual aproveitamento deste caso, seja por parte de quem for, para colocar em causa o exemplar desempenho das Forças (…), merecerá o maior repúdio e condenação da nossa parte”, acrescenta o comunicado.A Polícia Judiciária (PJ) confirmou hoje a execução de 100 mandados de busca e 10 detenções no âmbito da Operação Miríade, na sequência de um inquérito dirigido pelo Departamento de Investigação e Ação Penal de Lisboa.Em causa está a investigação a uma rede criminosa com ligações internacionais e que “se dedica a obter proveitos ilícitos através de contrabando de diamantes e ouro, tráfico de estupefacientes, contrafação e passagem de moeda falsa, acessos ilegítimos e burlas informáticas”, com vista ao branqueamento de capitais.Em comunicado, o Estado-Maior-General das Forças Armadas (EMGFA) revelou que alguns militares portugueses em missões na República Centro-Africana podem ter sido utilizados como “correios no tráfego de diamantes”, adiantando que o caso foi reportado em 2019.Para o EMGFA, “o que está em causa de momento é a possibilidade de alguns militares que participaram nas FND [Força Nacional Destacada], na RCA, terem sido utilizados como correios no tráfego de diamantes, ouro e estupefacientes” e que “estes produtos foram alegadamente transportados nas aeronaves de regresso das FND a território nacional”.;['Associação de Oficiais das Forças Armadas', 'Operação Miríade', 'tráfico de diamantes', 'ouro e droga'];https://24.sapo.pt/atualidade/artigos/associacao-de-oficiais-das-forcas-armadas-considera-estar-em-causa-bom-nome-das-forcas-armadas-caso-se-confirmem-suspeitas-de-trafico-na-rca
000046;Ministério Público do Brasil abre inquérito sobre conduta de redes sociais no combate a 'fake news';8 nov 2021 19:54;MadreMedia / Lusa;"O Ministério Público (MP) brasileiro instaurou hoje um inquérito para investigar como as redes sociais atuam contra as ""fake news"", que têm afetado o sistema democrático do país e a saúde da população, com mentiras sobre a pandemia.";As empresas responsáveis pelas redes sociais e plataformas de mensagens WhatsApp, Telegram, Facebook, Instagram, Twitter, TikTok e YouTube terão um prazo de dez dias para informar sobre as medidas que estão a aplicar para detetar e combater ações como a produção de conteúdo falso, a sua difusão em massa e a utilização de robôs e perfis fictícios para a sua divulgação.De acordo com o MP, as plataformas deverão também disponibilizar versões atualizadas das suas condições de utilização, políticas de moderação de conteúdos e relatórios de transparência, assim como especificar que canais colocaram à disposição para reclamações e indicar detalhadamente quais os comportamentos que violam as suas regras.O financiamento da disseminação de conteúdo falso será um dos principais pontos da investigação.“Essas práticas de desinformação organizada devem ser entendidas como formas de propaganda e, como tal, devem estar sujeitas ao controlo e regulamentação”, alertou o MP em comunicado.Segundo a entidade, a divulgação de notícias falsas e a desinformação conseguida através delas “colocam em risco a saúde da população e o funcionamento das instituições democráticas”.Nesse sentido, o órgão destacou que os efeitos das “fake news” têm sido sentidos “especialmente” durante a pandemia de covid-19, com a proliferação de informações que levam à minimização dos riscos da doença, ao uso de medicamentos sem eficácia comprovada e ao desconhecimento sobre a importância da vacinação.Também tiveram impacto no Estado de Direito no Brasil, “questionando” a confiança nas urnas eletrónicas para as eleições presidenciais do próximo ano e efetuando ataques digitais “coordenados” contra profissionais da imprensa, “o que pode representar uma forma reflexiva de censura”.A difusão de notícias falsas por grupos “digitais antidemocráticos” é investigada desde 2019 pelo Supremo Tribunal Federal e entre os envolvidos está o próprio Presidente brasileiro, Jair Bolsonaro, líder da extrema-direita brasileira, pela campanha de descrédito que desencadeou nas redes sociais contra as urnas eletrónicas, usadas nas eleições do país há mais de duas décadas.Uma comissão do Senado que investigou a gestão governamental da covid-19 também pediu que o chefe de Estado fosse suspenso das redes sociais, após ser acusado de divulgar notícias falsas sobre a pandemia.;['Facebook', 'Twitter', 'Instagram', 'YouTube', 'fake news', 'WhatsApp', 'Telegram', 'TikTok'];https://24.sapo.pt/atualidade/artigos/ministerio-publico-do-brasil-abre-inquerito-sobre-conduta-de-redes-sociais-no-combate-a-fake-news
000047;Covid-19:Incidência acumulada em Espanha sobe quase cinco pontos;8 nov 2021 19:45;MadreMedia / Lusa;A incidência acumulada de contágios de covid-19 subiu hoje em Espanha quase cinco pontos em relação a sexta-feira, para 58,6 por cada 100.000 habitantes diagnosticados nos últimos 14 dias, segundo os últimos dados divulgados pelas autoridades de saúde.;Este indicador da velocidade de transmissão da doença teve hoje mais uma subida, tendo passado de 53,8 casos (sexta-feira) para 58,6 (hoje) por cada 100.000 habitantes diagnosticados nos últimos 14 dias.Por outro lado, a Espanha registou 6.417 novos casos de infeção pelo coronavírus SARS-CoV-2 desde sexta-feira, tendo o Ministério da Saúde espanhol também notificado mais 54 mortes atribuídas à doença covid-19 durante o mesmo período de três dias.O número total de casos notificados no país desde o início da pandemia é de 5.032.056 e já morreram 87.558 pessoas devido à doença.Nas últimas 24 horas, deram entrada nos hospitais de todo o país 191 pessoas com covid-19 e o número de doentes hospitalizados subiu para 1.858 (eram 1.793 na sexta-feira), o que corresponde a 1,52% das camas ocupadas.Destes, 400 estão em unidades de cuidados intensivos (eram 386 na sexta-feira), ocupando 4,41% das camas desses serviços.Os serviços do Ministério da Saúde espanhol também informaram hoje que 37,40 milhões de pessoas já estão totalmente vacinadas contra a covid-19 (88,8% da população alvo), e 38,10 milhões têm pelo menos uma das doses do fármaco (90,5%).O primeiro-ministro espanhol, Pedro Sánchez, disse hoje que, dos 50 milhões de doses de vacinas contra a covid-19 que a Espanha irá doar no primeiro trimestre do próximo ano para os países mais vulneráveis, vão ser reservadas dois milhões para para serem entregues em contextos humanitários.O chefe do executivo espanhol fez o anúncio no ato comemorativo do 70º aniversário da Convenção de Genebra de 1951 relativa ao Estatuto dos Refugiados, que teve lugar em Madrid, e no qual, entre outros, também participou o Alto Comissário das Nações Unidas paraos Refugiados (ACNUR), Filippo Grandi.Pedro Sánchez salientou que está consciente de que os recursos contra a pandemia não chegaram a todos e que muitos refugiados estão em “extraordinária vulnerabilidade”, razão pela qual o governo quer reservar dois milhões de doses para serem destinadas a contextos humanitários.Até agora, a Espanha doou mais de 24 milhões de doses e espera atingir 50 milhões no primeiro trimestre do próximo ano.;['Covid-19'];https://24.sapo.pt/atualidade/artigos/covid-19incidencia-acumulada-em-espanha-sobe-quase-cinco-pontos
000048;Tribunal Constitucional considerou norma do IRS que impedia de refutar presunção de mais-valias inconstitucional;8 nov 2021 19:40;MadreMedia / Lusa;O Tribunal Constitucional considerou inconstitucional uma norma do IRS que impedia ao contribuinte a possibilidade de mostrar que a mais-valia na venda de um imóvel tinha sido efetivamente obtido era inferior àquele sobre o qual era tributado.;"Na origem deste acórdão do Tribunal Constitucional, recentemente publicado, está o caso de um contribuinte que, tendo vendido em 2009 um imóvel por montante inferior ao do seu valor patrimonial tributário (VPT), foi chamado a pagar mais-valias, em IRS, pelo valor mais elevado (o do VPT) por, à luz do nº 2 do artigo 44.º do Código do IRS, existir uma presunção inilidível.Depois de ver a Autoridade Tributária e Aduaneira indeferir-lhe o seu pedido de reclamação graciosa, o contribuinte em causa avançou para o Centro de Arbitragem Administrativa (CAAD), vendo este tribunal arbitral dar-lhe razão, considerando que a norma era inconstitucional, quando interpretada no sentido de que prevalece sempre o maior valor mesmo que o preço efetivamente praticado tenha sido inferior e que tal presunção é inilidível.A decisão do CAAD tem em conta uma decisão já anteriormente proferida pelo Tribunal Constitucional, num acórdão de 2017.No acórdão agora divulgado, o TC decidiu igualmente ""julgar inconstitucional a dimensão normativa extraída do artigo 44.º, n.º 2, do Código do Imposto sobre o Rendimento das Pessoas Singulares, na redação que lhe foi dada pelo Decreto-Lei n.º 198/2001, de 3 de julho, segundo a qual se estabelece uma presunção inilidível no âmbito de ganhos de mais-valias sujeitos a IRS, decorrentes da alienação onerosa de bens imóveis, por violação do princípio da capacidade contributiva ínsito nos artigos 103.º, n.º 1, e 13.º da Constituição da República Portuguesa"".De acordo com a lei, são sujeitas a tributação em sede IRS os ganhos obtidos com a venda de imóveis, considerando-se esse ganho o valor obtido pela diferença positiva (mais-valia) entre o valor de aquisição e o valor de realização (ou seja, o preço de venda do imóvel).Porém, como referiu à Lusa Patrick Dewerbe, sócio de Fiscal da CMS Rui Pena & Arnaut, o nº 2 do artigo 44.º do Código do IRS vem considerar que, sempre que o preço pago pelo contribuinte se mostre inferior ao valor da avaliação do imóvel para efeitos da determinação do IMT (ou seja, o VPT apurado nos termos do Código do IMI), será o VPT a servir de referência para determinação da mais-valia sujeita a tributação.Com esta presunção, refere, - que a lei chama de inilidível por não admitir prova em contrário – “o legislador faz prevalecer o valor patrimonial tributário do imóvel sobre o valor correspondente ao valor de venda, quando este for inferior àquele”, refere o fiscalista.“Esta determinação do rendimento tributável com recurso a presunções, sem possibilidade da sua ilisão por parte dos contribuintes, tem como consequência (e probabilidade) a tributação de mais-valias que não foram efetivamente auferidas pelos contribuintes”, acentua Patrick Dwerbe.Foi esta possibilidade de determinação do rendimento com recurso a presunções, sem possibilidade da sua ilisão por parte dos contribuintes, que o Tribunal Constitucional julgou inconstitucional por entender ser violadora do princípio da capacidade contributiva.Entretanto, uma alteração ao Código do IRS, em 2014, veio aditar ao artigo 44.º a possibilidade o contribuinte afastar a presunção prevista no nº 2, prevendo que esta “não é aplicável se for feita prova de que o valor de realização foi inferior ao ali previsto”.";['Tribunal Constitucional', 'IRS', 'mais-valia', 'venda de um imóvel'];https://24.sapo.pt/atualidade/artigos/tribunal-constitucional-considerou-norma-do-irs-que-impedia-de-refutar-presuncao-de-mais-valias-inconstitucional
000049;Câmara do Porto quer revistar regulamento da Movida para travar “botellón”;8 nov 2021 19:38;MadreMedia / Lusa;O presidente da Câmara do Porto revelou hoje que vai revisitar o regulamento da Movida, numa tentativa de travar o fenómeno do “botellón” e controlar a venda de bebidas ao postigo e o ruído em período noturno.;“Vamos revisitar naturalmente o regulamento da Movida, parece-nos que ele é demasiadamente estático e precisa de ser mais maleável”, afirmou Rui Moreira, na reunião de hoje do executivo municipal, quando interpelado pela vereadora da CDU.Antecipando os relatos de duas moradoras na zona da Movida, Ilda Figueiredo tentou sensibilizar a maioria liderada pelo independente para a necessidade de olhar com maior atenção os problemas da Movida, revisitando, por exemplo, horários de funcionamentos e reforçando a fiscalização.Embora tenha sido reforçada a intervenção das autoridades policiais, os moradores, indicou, consideram que é necessário fazer mais, e que deve ser a câmara a tomar estas medidas.Em resposta à CDU, Rui Moreira reconheceu que a cidade de Porto tem hoje um problema “muito grande” que se prende com o consumo que resulta de vendas que são feitas ao postigo ou em lojas de conveniência e que contribuí para o fenómeno de “botellón”, intensificado com o regresso à normalidade no pós-pandemia.O autarca adiantou que o município voltou a tentar sensibilizar a PSP para a necessidade de um controlo mais apertado, em zonas como as Virtudes, onde o problema é “permanente”.Salientando que o município podia neste caso ter uma atitude preventiva, Sérgio Aires do Bloco de Esquerda (BE) disse que o fenómeno do “botellón” não é alheio ao modelo de cidade, assente no turismo.O vereador considerou ainda que para o crescimento deste fenómeno muito contribui o preço das bebidas nos bares e discotecas, acrescentando que é necessário ter noção de que não vai ser possível controlar o “botellón” apenas com repressão.Em resposta às preocupações manifestadas, o vereador do pelouro, Ricardo Valente, adiantou que já está a ser trabalho com várias entidades o novo regulamento da Movida, estando a ser discutidas nomeadamente limitações de horários.Esta proposta de alargamento da zona da Movida, limitando os horários de funcionamento dos estabelecimentos, foi defendida por uma moradora que, no período dedicado ao público, denunciou o clima de insegurança em que vivem.“Se querem acabar com o “botellón” não é deixar abrir mais casas. (…) É um perigo para qualquer um. Estas casas teriam que ser envolvidas na zona da Movida e fechar mais cedo”, observou, Paula Amorim, defendendo ainda a limitação dos horário e implementação de uma fiscalização permanente.Numa intervenção também durante o período dedicado ao público, uma outra moradora, Sara Lopes, tinha já denunciado a venda de bebidas ao postigo e até em casas particulares, queixando-se de que, apesar das sucessivas queixas, o problema mantém-se.A moradora insurgiu-se ainda contra o ruído que impede o descanso de quem vive na zona da Movida e denunciou que junto à Cordoaria há tráfico de droga e sexo ao vivo.No domingo, a Polícia Municipal do Porto revelou que foram apreendidas cerca de 35 colunas de som portáteis nos últimos cinco fins de semana em zonas de animação noturna do Porto, por perturbação do descanso dos moradores, violando a Lei do Ruído.Só desde agosto, as autoridades municipais receberam mais de 350 reclamações sobre ruído excessivo em período noturno.Na conferência de imprensa onde foram apresentados estes dados, o presidente da Câmara do Porto disse ainda que o concurso para aquisição das primeiras 79 câmaras do sistema de videovigilância da cidade será lançado dentro de três a cinco meses “se não houver grande litigância”.O sistema desenhado para o Porto será implementado em três fases e inclui um total de 200 câmaras, e excluiu o equipamento, tecnologicamente ultrapassado, usado há cerca de uma década na zona da Ribeira e que, entretanto, foi desativado.;['Câmara do Porto', 'botellón', 'Movida'];https://24.sapo.pt/atualidade/artigos/camara-do-porto-quer-revistar-regulamento-da-movida-para-travar-botellon
000050;Fesap volta às negociações com o Governo esta quarta-feira;8 nov 2021 19:07;MadreMedia / Lusa;A Federação de Sindicatos da Administração Pública (Fesap) vai voltar à mesa de negociações com o Governo na quarta-feira e no dia 15, anunciou hoje esta estrutura sindical, que desconvocou a greve que tinha marcado para sexta-feira.;O secretário-geral da Fesap, José Abraão, disse à agência Lusa que as duas reuniões de negociação coletiva foram marcadas pelo gabinete do secretário de Estado da Administração Pública em resposta ao pedido que a federação fez na semana passada.Na convocatória para duas reuniões, o Ministério da Modernização do Estado e da Administração Pública, admitindo que a Fesap venha a requerer a reunião de negociação suplementar, propôs que a mesma se realize no dia 17.A Federação de Sindicatos da Administração Pública, filiada na UGT, anunciou no início da semana passada que ia desconvocar a greve marcada para 12 de novembro e que tinha pedido ao Governo uma reunião para esclarecer o futuro do aumento do salário mínimo nacional.O Secretariado Nacional da federação decidiu desmarcar a greve após ter analisado a situação política face ao chumbo parlamentar da Proposta de Lei do Orçamento do Estado para 2022.A greve tinha sido anunciada há cerca de duas semanas pela Fesap, que fez coincidir o protesto com a paralisação nacional já marcada pela Frente Comum, da CGTP.A Fesap, segundo José Abraão, decidiu a suspensão de todas as ações de protesto previstas até ao dia 25 de novembro, data em que seria aprovado, em votação final global, o Orçamento do Estado.O Presidente da República, Marcelo Rebelo de Sousa, já anunciou a realização de eleições legislativas antecipadas em 30 de janeiro de 2022.;['Federação de Sindicatos da Administração Pública', 'FESAP'];https://24.sapo.pt/atualidade/artigos/fesap-volta-na-quarta-feira-as-negociacoes-com-o-governo
000051;DGAV: Operadores das explorações de suínos têm de registar animais em dezembro;8 nov 2021 18:44;MadreMedia / Lusa;Os operadores das explorações de suínos estão obrigados a registar os animais no mês de dezembro, uma medida para controlo da doença de aujeszky, indicou a Direção-Geral de Alimentação e Veterinária (DGAV).;“No mês de dezembro, decorre mais um período obrigatório de Declaração de Existências de Suínos (DES)”, lê-se numa nota divulgada pela DGAV.A declaração das existências de suínos é uma medida sanitária de combate à doença de aujeszky, também conhecida como pseudorraiva, e o seu incumprimento acarreta penalizações, como a impossibilidade de emissão direta pelo operador de guias de trânsito de suínos para vida, através do iDigital.Esta declaração pode ser efetuada através do portal do Instituto de Financiamento da Agricultura e Pescas (IFAP).Os suinicultores são obrigados a proceder à declaração de existência três vezes por ano — abril, agosto e dezembro –, informando o número e categoria de animais que possuem.A doença de aujeszky pode afetar o sistema nervoso, respiratório e reprodutor dos porcos.Este vírus pode também ser transmitido, através dos suínos, para outros animais.A DGAV é um serviço central da administração direta do Estado, com autonomia administrativa.;['doença de aujeszky', 'pseudorraiva'];https://24.sapo.pt/atualidade/artigos/dgav-operadores-das-exploracoes-de-suinos-tem-de-registar-animais-em-dezembro
