id;title;datetime;partner;excerpt;text;tags;url
000032;Covid-19: EMA revê dados de medicamento antiviral molnupiravir;8 nov 2021 21:56;MadreMedia / Lusa;A Agência Europeia de Medicamentos (EMA) anunciou hoje que está a rever os dados disponíveis sobre a utilização do medicamento antiviral molnupiravir, de forma a apoiar as autoridades nacionais, caso decidam usá-lo no tratamento contra a covid-19.;Num comunicado publicado no ‘site’ oficial na Internet, a EMA explica que concordou, em conjunto com os Chefes das Agências de Medicamentos (HMA), “com a necessidade de orientações adicionais sobre os tratamentos covid-19, no seguimento do aumento das taxas de infeção e mortes por covid-19 em toda a União Europeia (UE)”.“Para o efeito, a EMA está a rever os dados disponíveis sobre a utilização do medicamento molnupiravir, de forma a apoiar as autoridades nacionais, caso estas decidam utilizar este medicamento para o tratamento da covid-19, antes da sua autorização efetiva”, adianta.O molnupiravir destina-se a ser tomado duas vezes por dia durante cinco dias por pessoas que estejam em casa com covid-19 ligeira a moderada e que tenham pelo menos um fator de risco de poder desenvolver doença grave.“Embora a avaliação contínua mais abrangente esteja em andamento antes de um possível pedido de autorização de introdução no mercado, o Comité de Medicamentos de Uso Humano (CHMP) da EMA, irá fornecer recomendações para todos os países da UE no mais curto espaço de tempo possível, de forma a ajudar as autoridades nacionais a decidir sobre o possível uso precoce do medicamento, por exemplo, através de uma autorização de utilização de emergência”, lê-se.O molnupiravir é um medicamento antiviral oral desenvolvimento por Ridgeback Biotherapeutic e Merck.Inicialmente concebido como uma potencial terapia da gripe e com financiamento do governo americano, este medicamento foi reorientado em 2020 por investigadores da Universidade Emory, no estado da Geórgia, para um possível tratamento da covid-19.A ação do molnupiravir visa uma enzima que o SARS-CoV-2 usa para se reproduzir, inserindo erros no seu código genético que retardam a capacidade de se espalhar e tomar conta de células humanas. Essa atividade genética levou peritos independentes a questionar se o fármaco poderia eventualmente causar mutações conducentes a defeitos de nascença ou tumores, mas a Merck frisou que o fármaco é seguro quando utilizado segundo as instruções.A farmacêutica anunciou ainda em outubro a sua permissão para que outros fabricantes possam produzir o seu comprimido, numa tentativa de ajudar milhões de pessoas em países mais pobres e com pouco acesso às vacinas.O Medicines Patent Pool, um grupo apoiado pelas Nações Unidas, revelou que a Merck não vai receber ‘royalties’ por este acordo enquanto a covid-19 for considerada uma emergência global pela Organização Mundial da Saúde.De acordo com os especialistas, um comprimido antiviral que reduz sintomas e acelera a recuperação pode revelar-se essencial no combate à pandemia, ao aliviar a sobrecarga dos hospitais e ajudar a travar surtos em países mais pobres e com sistemas de saúde frágeis.A covid-19 provocou pelo menos 5.047.055 mortes em todo o mundo, entre mais de 249,76 milhões infeções pelo novo coronavírus registadas desde o início da pandemia, segundo o mais recente balanço da agência France-Presse.Em Portugal, desde março de 2020, morreram 18.209 pessoas e foram contabilizados 1.098.125 casos de infeção, segundo dados da Direção-Geral da Saúde.;['Agência Europeia de Medicamentos', 'Covid-19', 'molnupiravir'];https://24.sapo.pt/atualidade/artigos/covid-19-ema-reve-dados-de-medicamento-antiviral-molnupiravir
000033;Presidente da Câmara de Matosinhos é candidata à liderança da Associação de Municípios;8 nov 2021 21:44;MadreMedia / Lusa;A presidente da Câmara de Matosinhos, a socialista Luísa Salgueiro, é candidata à liderança da Associação Nacional dos Municípios Portugueses, cujo congresso está agendado para dezembro, revelou hoje o homólogo de Vila Nova de Gaia.;“Não só apoio esta escolha, como tenho muito orgulho em achar que é a melhor solução para o reforço da Associação Nacional de Municípios Portugueses (ANMP)”, disse aos jornalistas o presidente da Câmara Municipal de Vila Nova de Gaia, Eduardo Vítor Rodrigues, após a reunião do executivo municipal.No decorrer de uma conversa sobre o processo de transferência de competências, previsto para março de 2022, e sobre a sua concretização perante a ausência de um Orçamento do Estado, o socialista acabou por revelar o nome desta candidata à liderança da associação, atualmente presidida pelo antigo presidente da Câmara de Coimbra, o socialista Manuel Machado.Eduardo Vítor Rodrigues assumiu estar “muito orgulhoso” por Luísa Salgueiro ser uma autarca da Área Metropolitana do Porto (AMP), à qual ele preside, e ter “créditos firmados”.Contactada pela Lusa, Luísa Salgueiro não quis tecer comentários.O congresso da ANMP está agendado para 11 e 12 de dezembro, em Aveiro, para, designadamente, eleger os dirigentes para o próximo mandato, depois das eleições autárquicas de setembro.A Associação Nacional de Municípios Portugueses é uma entidade de direito privado, fundada em maio de 1984, responsável pela promoção, defesa, dignificação e representação do Poder Local.;['matosinhos', 'Associação Nacional de Municípios Portugueses', 'Câmara de Matosinhos', 'Luísa Salgueiro'];https://24.sapo.pt/atualidade/artigos/presidente-da-camara-de-matosinhos-e-candidata-a-lideranca-da-associacao-de-municipios
000034;"Primeira-ministra escocesa ""horrorizada"" com hipótese de Londres suspender Protocolo para a Irlanda do Norte";8 nov 2021 21:05;;"A primeira-ministra da Escócia, Nicola Sturgeon, mostrou-se hoje ""horrorizada"" com a possibilidade de o Governo britânico suspender unilateralmente o Protocolo para a Irlanda do Norte, parte do acordo do Brexit.";"Numa reunião virtual com jornalistas da Foreign Press Association no Reino Unido, a líder nacionalista expressou a sua opinião sobre as consequências de um cenário hipotético em que o primeiro-ministro britânico, Boris Johnson, ativasse o Artigo 16 do Protocolo, que permite a uma das partes deixar de aplicar aspetos do acordo, e alertou para o risco de desencadear uma ""guerra comercial"" com a União Europeia (UE).Sturgeon confessou que está ""profundamente preocupada"" com as implicações de suspender o mecanismo que mantém a província britânica no mercado único europeu de mercadorias, a fim de evitar uma fronteira física com a vizinha República da Irlanda, membro da UE.Em troca, impõe controlos fronteiriços entre a Irlanda do Norte e o resto do Reino Unido, o que tem conduzido a fricções económicas e tensões políticas.""A UE fez sugestões muito razoáveis para resolver algumas das questões práticas em torno da aplicação do protocolo e, em vez de se envolver de forma responsável com vista a alcançar um resultado sensato, o Governo de Boris Johnson parece estar continuamente a tentar inflamar tensões, o que me parece ser motivado por razões políticas e ideológicas"", disse Sturgeon.Ao mesmo tempo, considerou que o Executivo de Londres ""está a arriscar desencadear uma guerra comercial com a UE que não seria do interesse de ninguém"".A política escocesa disse esperar que ""o bom senso prevaleça finalmente"", embora estando ""profundamente preocupada"" com o que pode acontecer ""nas próximas semanas"".A política escocesa também abordou a questão da independência escocesa e, depois de se ter declarado ""defensora da democracia"", recordou que a sua vitória nas últimas eleições foi forjada com base ""na proposta de que durante a primeira metade desta legislatura - se a covid-19 o permitir - os escoceses deveriam ter a oportunidade de decidir se querem ou não ser independentes"", sublinhou.Recordando que a Escócia já realizou um referendo de independência em 2014, no qual o ""não"" à separação venceu, Sturgeon observou que ""o mundo mudou bastante dramaticamente"" desde então, com fatores como o Brexit, que se materializaram ""contra a vontade"" dos escoceses.Na sua opinião, um hipotético referendo deveria ser ""democrático, constitucional e legal"", embora tenha advertido que ""se Boris Johnson quiser negar a democracia, a dada altura terá de levar o Parlamento escocês a tribunal"".";['Brexit', 'Reino Unido', 'Escócia', 'Nicola Sturgeon', 'Irlanda do Norte'];https://24.sapo.pt/atualidade/artigos/primeira-ministra-escocesa-horrorizada-com-hipotese-de-londres-suspender-protocolo-para-a-irlanda-do-norte
000035;"Costa: ""Com ou sem maioria, não deixarei de dialogar""";8 nov 2021 21:01;MadreMedia;O primeiro-ministro, António Costa, foi entrevistado por António José Teixeira, na RTP, esta segunda-feira, naquela que foi a primeira entrevista depois do chumbo do orçamento e do anúncio de eleições antecipadas. ;"Numa entrevista em São Bento, o primeiro-ministro confessou que só no final percebeu que o Orçamento do Estado iria ser chumbado.""Fizemos tudo, tudo o que estava ao nosso alcance para garantir ao país o orçamento de que precisava e estivemos a negociar até ao último minuto"", afirmou.Questionado sobre se imediatamente antes da votação já sabia que o Orçamento ia ser chumbado, António Costa afirmou que ""tinha uma réstia de esperança que houvesse, no último minuto, alguém que percebesse que o país precisava mesmo de um Orçamento, de estabilidade e que não se podia desperdiçar a oportunidade extraordinária de sair da pandemia, mas também de se recuperar tudo aquilo que se perdeu ao longo dos últimos dois anos"".Já sobre se aquando da aprovação do PRR, teria realmente ficado com a ideia de que haveria ""muitos interessados em deitar abaixo o Governo"", o primeiro-ministro justificou apenas dizendo que ""ao longo destes seis anos conseguimos construir uma solução que foi nova, que garantiu seis anos de estabilidade e que foi a solução pluripartidária mais estável que tivemos até agora. Conseguimos virar a página da austeridade, vencer a batalha contra as sanções da União Europeia, conseguimos ter o primeiro excedente orçamental"", rematando que ""agora, cabe aos portugueses escolher"" - referindo-se às eleições legislativas de 30 de janeiro.Sobre o que faltou para a aprovação deste Orçamento, reafirmou que “o Governo fez tudo para ir ao encontro das preocupações dos parceiros”, elencando os vários pontos nos quais cedeu.""Houve dois pontos que bloquearam a solução”, salientou o primeiro-ministro, referindo que um tem que ver com a sustentabilidade da Segurança Social e outro com a questão do salário mínimo.""Vivemos num país de salários muito baixos e em que temos de ter a ambição de subir significativamente os salários, não só o mínimo mas todos os outros. O salário mínimo, desde 2016 até agora, já subiu 39%. A proposta que temos para o próximo ano é do maior aumento de sempre do salário mínimo, estes 40 euros. Aquilo que nos era proposto pelo PCP, para chegar aos 800 euros, era subir só no próximo ano mais do que subimos nos quatro anos da legislatura anterior"", notou.António Costa referiu ainda que seria ""muito fácil dizer sim"", mas questiona se tal medida seria responsável, justificando que as empresas do turismo e do comércio teriam de acompanhar este aumento depois da crise económica gerada pela pandemia, numa altura de tantas incertezas.""Não se está a falar de verbas de OE, mas sim da capacidade de sustentação das empresas. Eu não tenho mandato para isso"", justifica, questionando se seria ""realista"" adotar esta medida para chegar aos 800 euros.Costa defendeu ainda a necessidade de haver uma discussão geral sobre a ""valorização dos salários, em particular dos jovens"", por não considerar ""aceitável os vencimentos que têm"", mas alerta que é necessário verificar se haverá tampouco ""acordo para os 705 euros"".Defendendo que não poderá comprometer o futuro da Segurança Social, Costa destacou que as “reservas da Segurança Social, que servirão para sustentar os anos de défice, aumentaram em 22 anos"" e que ""foi essa força que permitiu responder como respondemos a esta crise"", dando como exemplo o pagamento do lay-off durante a pandemia e acrescentando que “se enfraquecermos a Segurança Social hoje perdemos capacidade de resposta a crises que possam surgir"".Sobre as negociações disse ainda: ""Fomos ao limite dos limites. Em consciência, uma pessoa, para se manter no poder, não pode ceder a qualquer coisa. E qual é o limite? É o limite da razoabilidade"".Já questionado sobre se houve uma intenção prévia por parte de BE e PCP para o chumbo do OE2022, o primeiro-ministro escusou-se a responder e disse que não ia ""abrir feridas que importa sarar"", reiterando que ""Portugal tem de superar esta crise"".Sobre a ideia, lançada pela esquerda, de que o seu objetivo é alcançar uma maioria absoluta, respondeu: “Tenho-os ouvido e não vou responder. O país não quer mais polémicas, não quer tricas políticas, quer que nos concentremos a cumprir o nosso dever que é encontrar soluções"", acrescenta. ""O que eu sinto, o que o país sente, é que os políticos não tiveram respeito pelo sacrifício que as pessoas fizeram”.Costa admitiu, ainda, que “se tivesse havido vontade, o Orçamento não tinha chumbado”.Questionado sobre a possibilidade de haver um segundo orçamento, António Costa relembrou que o Presidente da República avisou, desde logo, que se não houvesse Orçamento dissolveria a Assembleia da República e que, por isso, ""ninguém votou ao engano"" e ""ninguém pode dizer que foi enganado pelo Presidente da República"".António Costa disse compreender a decisão do chefe de Estado de dissolver o parlamento e de convocar eleições antecipadas a seguir ao chumbo da proposta do Governo de Orçamento.“Havendo uma rejeição de fundo – aliás, sobre outras matérias que não tinham a ver com o Orçamento –, o Presidente da República, Marcelo Rebelo de Sousa, entendeu que isso significava que a base política em que este Governo assentava tinha desaparecido e, portanto, fazia sentido ir para eleições”, observou.“Ninguém gosta destas eleições antecipadas. Sinceramente, acho que não é possível apontar o dedo ao Presidente da República. Acho que o Presidente da República, perante as circunstâncias com que foi confrontado pelos partidos, não lhe restava escolher a menos má de todas as más soluções”, acrescentou.""A solução boa era ter havido um Orçamento viabilizado, sem colocar em causa o futuro do país”.Já sobre a escolha do Presidente da República de convocar eleições para 30 de janeiro próximo, quando o PS tinha proposto o dia 16 desse mês, Costa desvalorizou essa questão: “Quanto mais depressa melhor, mas o que é preciso é que todos se sintam bem e confortáveis. A data não é a questão fundamental. A questão fundamental que se coloca aos portugueses é saberem que Governo querem e em que condições desejam que governe”.Sobre a possibilidade de governar em duodécimos, Costa afirmou que ""tem imensas limitações"", mas que ""quando se é primeiro-ministro está-se obrigado a estar disponível, quaisquer que sejam as circunstâncias - boas ou más"".Em relação a eventuais cenários pós-eleitorais, Costa respondeu sobre a possibilidade de um novo entendimento à esquerda, assegurando que não gosta de ""fechar portas ou abrir portas"", mas que “em eleições, há que ter humildade de perceber que quem escolhe os resultados são os portugueses”.O primeiro-ministro recusou também que uma maioria absoluta do PS seja perigosa para a democracia, recorrendo ao período em que foi presidente da Câmara de Lisboa, a partir de 2013 com maioria absoluta. “Peço o voto dos portugueses para uma solução estável para quatro anos de Governo. Com ou sem maioria [absoluta], não deixarei de dialogar”, declarou.“Acho que ninguém tem medo da minha ação e da forma como governamos, ninguém tem dúvidas de que o Presidente da República não deixará de estar atento, que a comunicação social estará atenta e que o poder judicial é livre e independente”, argumentou.Logo a seguir, confrontado com um cenário em que o PS saia das próximas eleições legislativas novamente com uma vitória com maioria relativa, António Costa respondeu: “Procurarei um entendimento duradouro com os nossos parceiros”, disse, numa alusão ao Bloco de Esquerda, PCP e PEV.O líder socialista defendeu a tese de que “a escolha fundamental dos portugueses é se querem regressar a um Governo do PSD ou se querem dar continuidade a um Governo do PS”.“E, dando continuidade a um Governo do PS, em que condições querem que o Governo do PS governe: Querem dar força a esse Governo para poder governar de forma estável, de uma forma duradoura, ou não querem. É uma opção dos portugueses. Eu estou de bem, eu ficarei de bem qualquer que seja a votação"", completou.“Há uma lição que todos temos a retirar destes anos: Bati-me por esta solução, mas não escolho a orientação nem do PCP nem do BE. Se o PCP e o BE optaram por ser partidos de protesto, tenho de respeitar. Custa-me muito, devo dizer, porque acho que foi um desperdício de oportunidades”, considerou. António Costa admitiu que a seguir às eleições de 30 de janeiro “novos tempos virão”.Depois das eleições, de acordo com António Costa, colocam-se pelos menos dois cenários após uma eventual nova vitória dos socialistas: “ou o PS tem maioria para poder governar sozinho; ou o PS é claramente reforçado, mesmo não tendo maioria – e acho que isso inevitavelmente também implica que os nossos parceiros à esquerda também reflitam, porque fizeram asneira e as pessoas não compreenderam o que fizeram”.“Nesse caso, poderão emendar a mão e trabalhar com o PS de boa fé, com espírito construtivo, como fizemos na legislatura anterior. Eu não fecho a porta a ninguém"", reforçou.\Confrontado com a tese de que a “Geringonça” que nasceu em novembro de 2015 está já morta, António Costa concordou e comentou que o dirigente histórico socialista Manuel Alegre já lhe “passou o atestado de óbito”.“Esta fórmula, como tivemos desde 2016, até agora, essa indiscutivelmente acabou, É uma questão de facto. O que é que virá a seguir? Vamos ver o que os portugueses decidem que venha a seguir"", argumentou.Já sobre um eventual entendimento do PS com o PSD a seguir às eleições, António Costa não respondeu diretamente à pergunta. ""Primeiro, é preciso deixá-los organizarem-se a si próprios, e depois falamos sobre os partidos à direita do PS. Neste momento, como é sabido, estão num processo interno, a arrumar a sua própria casa. Não vou interferir nesse processo. É um processo que lhes diz respeito"", alegou.O primeiro-ministro afirmou que, se vencer as próximas eleições legislativas, recandidata-se à liderança do PS em 2023, mas sairá de secretário-geral se as perder, já que considera que se abrirá então um novo ciclo político.“Obviamente, se estiver em funções como primeiro-ministro, claro que me candidato à liderança do PS"", disse. No entanto, confrontado com o cenário de uma derrota eleitoral a 30 de janeiro próximo, António Costa declarou: ""Se perdesse as eleições, é evidente que não ficaria na liderança do PS"".""Isso significaria abrir um novo ciclo de governação. Quem está há seis anos como primeiro-ministro em funções, como eu tenho estado, com muita honra em servir Portugal e os portugueses em momentos tão difíceis como estes que vivemos, quando chegamos a esta fase, os portugueses conhecem-me, sabem quais são os meus defeitos, espero que saibam também quais são as minhas qualidades e, portanto, decidirão livremente. E eu acho que os portugueses saberão julgar tudo e decidir o que é que querem para futuro”, afirmou.Costa afirmou que “fará tudo"" para verificar o aumento do salário mínimo nacional (cuja proposta é de 705 euros) e que o seu Governo apresentou na concertação social uma proposta para o aumento.Em relação à atualização dos salários dos funcionários públicos para 2022, que o Governo apontou para 0,9% no próximo ano, António Costa também referiu que o seu executivo pode avançar já.“O que nós não faremos, porque não devemos fazer, é tudo aquilo que tem natureza extraordinária"", disse, numa alusão à proposta que esteve em cima da mesa nas negociações do Orçamento, com o PCP, no sentido de se proceder a um aumento extraordinário de 10 euros de todas as pensões até aos 997 euros.“Há uma atualização dos salários da função pública, com um aumento normal das pensões. O aumento extraordinário não, porque é precisamente extraordinário"", justificou.“Havendo convocação de eleições, os portugueses vão ser livres de escolher a continuação deste Governo ou de outro Governo. Todos esses compromissos que nós assumimos constarão do meu programa eleitoral com o compromisso de serem aplicados retroativamente ao dia 01 de janeiro"", frisou.Se vencer as eleições legislativas, António Costa prometeu que cumprirá essas medidas “retroativamente a dia 1 de janeiro”.“Vamos fazer tudo o que é normal fazer: Subida do salário mínimo, atualização dos salários [da função pública], atualização das pensões. Quanto aos outros compromissos, como a atualização extraordinária das pensões, a redução do IRS, a criação das novas prestações sociais, designadamente do combate à pobreza infantil, todas essas medidas extraordinárias ou novas medidas, incluiremos no programa eleitoral com o compromisso de as aplicarmos retroativamente ao dia 01 de janeiro”, frisou.Questionado sobre a investigação que está a incidir sobre asForças Armadas, o primeiro-ministro destacou que atuaram logo, comunicando às autoridades judiciárias para que tomassem as providências necessárias, perante suspeitas de crime por parte de militares portugueses em missão na República Centro Africana.“Preocupa-me que haja uma rede de qualquer tipo de criminalidade onde quer que seja, e nas Forças Armadas por maioria de razão”, declarou António Costa em entrevista à RTP, depois de confrontado com a investigação a uma rede criminosa com ligações internacionais e que se dedicará ao contrabando de diamantes e ouro, tráfico de estupefacientes, contrafação e passagem de moeda falsa.Sobre este caso, o líder do executivo salientou que “as próprias Forças Armadas detetaram e, mal detetaram, comunicaram às autoridades judiciárias para tomarem as providências necessárias”.“Vivemos num país onde ninguém está acima das leis, sejam as Forças Armadas, sejam as forças de segurança, seja político, seja quem for”, frisou.Questionado se este caso terá um impacto negativo nas Forças Armadas, designadamente na sua imagem internacional, António Costa recusou.“Não creio. O senhor ministro da Defesa [João Gomes Cravinho] já o disse, informámos imediatamente as Nações Unidas do que tinha acontecido. Não vou desvalorizar dizendo que não é um caso inédito, qualquer caso é um caso em si grave”, respondeu.Interrogado se o Governo tenciona propor em breve ao Presidente da República um novo chefe do Estado Maior da Armada, António Costa respondeu que esse é um assunto que o executivo tratará com o chefe de Estado.“E não trataremos seguramente através da televisão, trataremos cara a cara, como sempre temos. Quando o fizermos, o Presidente da República anunciará”, respondeu.António Costa referiu depois que estes cargos “são de propositura do Governo e de nomeação do Presidente da República”.“Até agora foi sempre o senhor Presidente da República a anunciar a nomeação desta senhora ou daquele senhor. E assim será"", acrescentou.*com Lusa";['Antonio Costa', 'Eleições', 'Pensões', 'Orçamento do Estado', 'desdobramento do IRS'];https://24.sapo.pt/atualidade/artigos/costa-fizemos-tudo-o-que-estava-ao-nosso-alcance-para-garantir-ao-pais-o-orcamento-de-que-precisava
